<?xml version="1.0" encoding="UTF-8"?><xmlgui-styles xmlns:xsi="http://www.w3.org/2001/XMLSchema-instance" xsi:noNamespaceSchemaLocation="D:\Uni\Projektarbeit\Projekt_20.04.04\stylesSchema.xsd">	<widget-styles>		<uiType name="default" type="button">					<foreground>				<color>red</color>			</foreground>			<background>				<color>green</color>			</background>			<font>				<color>black</color>				<width>1</width>				<height>1000</height>				<type></type>			</font>			<border>				<color>yellow</color>							<width>10000</width>				<type/>			</border>		</uiType>	</widget-styles></xmlgui-styles>