<?xml version="1.0" encoding="UTF-8"?><xmlgui-styles xmlns:xsi="http://www.w3.org/2001/XMLSchema-instance" xsi:noNamespaceSchemaLocation="D:\Uni\Projektarbeit\Projekt_20.04.04\stylesSchema.xsd">	<widget-styles>		<!-- default layout for Buttons -->		<uiType id="defaultButton" type="button">			<background>				<color>grey</color>			</background>			<font>				<color>black</color>				<size>10</size>				<type>Times New Roman</type>			</font>		</uiType>		<!-- default layout for Textfields-->		<uiType id="defaultTextfield" type="textfield">			<background>				<color>white</color>			</background>			<font>				<color>black</color>				<size>10</size>				<type>Times New Roman</type>			</font>			<border>				<color>black</color>				<width>1</width>				<!-- durchgezogene Linie -->				<borderType>line</borderType>			</border>		</uiType>		<!-- default layout for MenuItems-->		<uiType id="defaultMenuItem" type="menuitem">			<background>				<color>grey</color>			</background>			<font>				<color>black</color>				<size>10</size>				<type>Times New Roman</type>			</font>		</uiType>		<!-- default layout for Checkboxes -->		<uiType id="defaultCheckbox" type="checkbox">			<background>				<color>white</color>			</background>			<font>				<color>black</color>				<size>10</size>				<type>Times New Roman</type>			</font>		</uiType>		<!-- default layout for Comboboxes -->		<uiType id="defaultCombobox" type="combobox">			<background>				<color>white</color>			</background>			<font>				<color>black</color>				<size>10</size>				<type>Times New Roman</type>			</font>		</uiType>	</widget-styles></xmlgui-styles>